Unnamed: 0,Customer Name,Review Rating,Review Title,Review Content,Product Name,polarity
76,Mary Catherine,5.0 out of 5 stars,Awesome phone!!,love,Apple iPhone 11 Pro Max (64GB) - Midnight Green,0.5
77,Deepak Malviya,5.0 out of 5 stars,"Fabulous design and outstanding camera, perfect upgrade, awesome camera",using iphone xs max iphone 11 pro max say fabulous outstanding perfect always performance goodnight mode better available camera pixel 4 xl mate 30 pro note 10this device unbeatable next iphone,Apple iPhone 11 Pro Max (64GB) - Midnight Green,0.4666666666666666
78,Chiranjit Das,5.0 out of 5 stars,The Best iPhone Apple has to offer... today,love iphone pro max purchased amazon oct 14th 2019 space grey 64 gb base model delivered oct 19th objective views phonewhat didnt like1 obviously price tag rs 10909900 major deterrent comes decide buying phone2 base model certainly begin 128 gb higher 64 gb gonna enough storing 4k videos3 optical zoom camera still 2x android phones already 5x zoomsnow love phone1 camera main reason upgraded iphone x 11 pro max ultrawide lens improved telephoto lens night mode improved portrait options give exceptional results snaps taken phone could compete professional dslrs 4k video recording support front camera additional bonus2 battery life reviews right used charge iphone x every night whereas amount usage charge 11 prod max 2 nights3 display already big fan 58 oled display iphone x 65 11 pro max offers best oled display come across smartphones4 face id faster apps interface work smoothly ever5 ios 13 though still needs fixes wonderful operating system dark mode welcome changeoverall beast admire apple catching android counterparts several features 11 pro max definitely phone amateur professional photographers,Apple iPhone 11 Pro Max (64GB) - Midnight Green,0.17391975308641974
79,Ghanshyam Dubey,1.0 out of 5 stars,Mobile on off button is not working,switch button working looks like given used phone new box,Apple iPhone 11 Pro Max (64GB) - Midnight Green,0.13636363636363635
80,Arjun,1.0 out of 5 stars,Bad product don't buy😢,bad product dont buy,"Vivo V19 (Mystic Silver, 8GB RAM, 128GB Storage) with No Cost EMI/Additional Exchange Offers",-0.6999999999999998
81,Soumyaranjan Nanda,5.0 out of 5 stars,Outstanding..,superb phone light weight premium look camera quality outstanding phone contains many animationswhich makes phone interesting must buy guysprofermance also good music loud,"Vivo V19 (Mystic Silver, 8GB RAM, 128GB Storage) with No Cost EMI/Additional Exchange Offers",0.5285714285714286
82,Inamul Hoque,3.0 out of 5 stars,Price high,price much high,"Vivo V19 (Mystic Silver, 8GB RAM, 128GB Storage) with No Cost EMI/Additional Exchange Offers",0.16
83,Hiren Rathod,5.0 out of 5 stars,See my Detail Review,1 month use1look build quality good2 camera quality feature mind blowing3 battery 33w fast charger goodcharge 10 100 40 45 minutes4 ram management supergood multitasking5 display e3 super amoledpicture quality nice stream video full hd like amazon prime video netflix6 audio output clear loud7 network quality good8 lot new ai feature provide phoneoverall smartphone fulfill technical needsgood work,"Vivo V19 (Mystic Silver, 8GB RAM, 128GB Storage) with No Cost EMI/Additional Exchange Offers",0.24567099567099568
84,Yam k,5.0 out of 5 stars,Camera is too good,superb one best vivo mobiles v19 superb price little high phone awesome,"Vivo V19 (Mystic Silver, 8GB RAM, 128GB Storage) with No Cost EMI/Additional Exchange Offers",0.6620833333333334
85,MUKESH KUMAR MEENA,3.0 out of 5 stars,Mobile price high,nice mobile price high,"Vivo V19 (Mystic Silver, 8GB RAM, 128GB Storage) with No Cost EMI/Additional Exchange Offers",0.38
86,Manoj Nayak,5.0 out of 5 stars,Go For It....If U Want All In One Pack,expect price everything perfecta beautiful mobile daily usestunning displaybeautiful selfie camera front rarebest batteryfast chargingtotally perfect rounder mobile,"Vivo V19 (Mystic Silver, 8GB RAM, 128GB Storage) with No Cost EMI/Additional Exchange Offers",0.6166666666666667
87,Madan Lal,5.0 out of 5 stars,Super,super mobile phone,"Vivo V19 (Mystic Silver, 8GB RAM, 128GB Storage) with No Cost EMI/Additional Exchange Offers",0.3333333333333333
88,Rupinderdeep singh,5.0 out of 5 stars,Super phone in good price,awesome phone pricebattery back impressivefront camera outstandingbefore regular customer oneplus phones price oneplus phones high vivos present fully loaded phone reasonable price love device,"Vivo V19 (Mystic Silver, 8GB RAM, 128GB Storage) with No Cost EMI/Additional Exchange Offers",0.2657142857142857
89,vignesh,1.0 out of 5 stars,not worth for money,phone worth 28k performance bad using 7 days im writing review1 gamer dont run app consume high performance regular banking social apps default phone apps internal memory consumed 20gb still phone takes time load home page really ridiculous2 modes phone working exactly upto mark dark mode change dark mode time select may change phone wishes viseversa would like deselect dark mode b loading screen flickering occurs often many common applications gdrive gpay whatsapp opera browser c receivers seeing face whatsapp app video call duo working fine call receivers facing issuecamera test much didnt see issues clarity goodfinget scan fast compare competitor phonesmy overall rating 1 5complaint registered amazon technician visit inspect phone complaints works randomly screen recored shots proof show,"Vivo V19 (Mystic Silver, 8GB RAM, 128GB Storage) with No Cost EMI/Additional Exchange Offers",0.017222222222222236
90,Rohan sharma,2.0 out of 5 stars,Range is higher then quality,could think compete brands low photography brands comes 48mp quad rear camera,"OPPO A52 (Stream White, 6GB RAM, 128GB Storage) with No Cost EMI/Additional Exchange Offers",0.0
91,Arpana,1.0 out of 5 stars,Dont buy!!,waste money,"OPPO A52 (Stream White, 6GB RAM, 128GB Storage) with No Cost EMI/Additional Exchange Offers",-0.2
92,aditya patel,5.0 out of 5 stars,Shandar Looking,looking awesome purchased younger brother happy get phonenice fast deliveryi hope camera performance good alsoi review someday using,"OPPO A52 (Stream White, 6GB RAM, 128GB Storage) with No Cost EMI/Additional Exchange Offers",0.54
93,Faisal qurshie,3.0 out of 5 stars,Best sound reasonable rate,good phone,"OPPO A52 (Stream White, 6GB RAM, 128GB Storage) with No Cost EMI/Additional Exchange Offers",0.7
94,SUMANTA ADHURJYA,4.0 out of 5 stars,Amazing,nice phonebut price little bit high,"OPPO A52 (Stream White, 6GB RAM, 128GB Storage) with No Cost EMI/Additional Exchange Offers",0.19083333333333333
95,Sasa,4.0 out of 5 stars,Oppo A52,chose mobile others later delivery area go lockdownprime fast delivery kudos amazonabout mobile good piece better go 6 gb ram variantselfie camera outperforms primary camera according specsoverall good decent mobile price point considering aspectspros price1 65 inch full hd good2 128 gb internal memorycons price1 primary camera actually bad2 4gb ram cant multitask3 snapdragon older,"OPPO A52 (Stream White, 6GB RAM, 128GB Storage) with No Cost EMI/Additional Exchange Offers",0.2986111111111111
96,Krishnakant Nigam,1.0 out of 5 stars,Heating problem,heating problem therevery bad experience,"OPPO A52 (Stream White, 6GB RAM, 128GB Storage) with No Cost EMI/Additional Exchange Offers",-0.6999999999999998
97,abhishek,5.0 out of 5 stars,Camera and processor is good,nice camera,"OPPO A52 (Stream White, 6GB RAM, 128GB Storage) with No Cost EMI/Additional Exchange Offers",0.6
98,DARSHA H JIWANI,5.0 out of 5 stars,Nice phone,nice phone,"OPPO A52 (Stream White, 6GB RAM, 128GB Storage) with No Cost EMI/Additional Exchange Offers",0.6
99,MANOJ KUMAR,3.0 out of 5 stars,Oppo a 52,phone call recording function,"OPPO A52 (Stream White, 6GB RAM, 128GB Storage) with No Cost EMI/Additional Exchange Offers",0.0
