Unnamed: 0,Customer Name,Review Rating,Review Title,Review Content,Product Name,polarity
36,Ansh satoeya,3.0 out of 5 stars,Not good like other phones of xiaomi.,mobile phone screen issue completely black wall paper black background theres permanent white dot like screen defective screen requested replacement soon device replaced although device preety average ram management goodgo snapdragon rather mediatekpubg lags sometimes medium settings theres ton preloaded apps apps cannot uninstallthere several options market xiaomi sochoose device wisely,"Redmi Note 9 (Pebble Grey, 4GB RAM 64GB Storage) - 48MP Quad Camera & Full HD+ Display - 3 Months No Cost EMI on BFL",0.036111111111111115
37,Surya K.,4.0 out of 5 stars,Everything nice but only body vibration problem due to plastic back,nice phone smooth performance charge service decent screen quality superb sound ok body vibration issue speaker mode time calling body vibration present notification light overall decent performance price phone support 18 watt fast charge charger support 225 watt,"Redmi Note 9 (Pebble Grey, 4GB RAM 64GB Storage) - 48MP Quad Camera & Full HD+ Display - 3 Months No Cost EMI on BFL",0.3484848484848485
38,Siddhanth Reddy,5.0 out of 5 stars,Good phone..,totally impressed built looks 13k thought getting realme 6i stocks barely lastso decided get phone phone great smooth gaming experience also good good g90tg85 decent processor great daily life performanceif 12k budget go itor 13krealme 6i 14k go poco m2 scarlet red looks stunning,"Redmi Note 9 (Pebble Grey, 4GB RAM 64GB Storage) - 48MP Quad Camera & Full HD+ Display - 3 Months No Cost EMI on BFL",0.4651515151515152
39,Rakesh kumar,1.0 out of 5 stars,Pathetic service by Amazon and worst quality mobile,worst mobile ordered mobile august 03 received 22nd looking mobile display good switched working even though tried charge charging completely dead power mobilei received defect piece try return mobile nobody coming pickup amazon refund optionbuying mobile amazon worst decisionso multiple follow ups someone amazon picked phone return updated yet app communication updated amazon called amazon customer service care like woke sleepmooning asked wait hold never came back talk felt strange call disconnectedits strange behavior amazon regular nd authorized customer amazon since years,"Redmi Note 9 (Pebble Grey, 4GB RAM 64GB Storage) - 48MP Quad Camera & Full HD+ Display - 3 Months No Cost EMI on BFL",-0.17777777777777778
40,shailesh,5.0 out of 5 stars,Samsung m31 all rounder  best mobile.,best camera good battery life eat body material average weight best performance best display,"Samsung Galaxy M31 Prime Edition (Ocean Blue, 6GB RAM, 128GB Storage) - Get Complementary 3 month Prime Membership",0.71
41,Ajay KS,5.0 out of 5 stars,Best Value for Money in this Range. Go for it without any doubt.,best thing get price reputed brand made india tag first time ordered first day online launch happy im writing days usage different experience samsung consistent compared mobile brands ive used earliergood android 10 beautiful looks finally delete sms notification display excellent blue light filter performance good heating lagging real racing worked fine 6000 mah battery big 128 gb storage pretty good 512 gb card supported dedicated external card slot dedicated sim slots support lte fast charging 15w charger top phone phone came 0 charge charged fast mobile speakers sound good prefer external speakers better bass music camera really good macro performance good look skin tatoo photo dust perticles deskphone photo photos m31 phone front rear camera support fhd video 3840x2160 may require carry dslr everyehere face unlock figureprint sensor response good received next day 11 good thin ok doesnt samsung dex started boot screen gave little shock selected reboot option every thing smooth android updated many application updates normal case appeared within days launch update smooth issue feels delicate hand rs49 cover good enough wrongly ordered black set blue 49 reorder blue one well called samsung store information availability date still call themfeedback feels good hand use powerhouse feel update days use dont doubt nowgo without doubt,"Samsung Galaxy M31 Prime Edition (Ocean Blue, 6GB RAM, 128GB Storage) - Get Complementary 3 month Prime Membership",0.30461956521739125
42,surojit das,1.0 out of 5 stars,Poor camera,3rd class front camera 32 mp front camera n looks like 2mp front camera disappointed kind front camera need refund,"Samsung Galaxy M31 Prime Edition (Ocean Blue, 6GB RAM, 128GB Storage) - Get Complementary 3 month Prime Membership",-0.05000000000000001
43,Riddham Jain,1.0 out of 5 stars,"False ads, poor camera quality, inefficient battery management",lets begin obvious phones quality doesnt meet claims madecons1 camera quality picture quality awful worse 8mp camera pixelization obvious definitely 64mp camera believe claims samsung might make quad camera use macro camera reminds decade vga cameras common2 battery samsung may claim battery last two days didnt last long netflix prime video heavy games used makes two biggest features useless3 amazons policy case dont like phone amazon made sure stuck switch 10 day return policy 10 day replacement policy dowright wrong hold onto shutters physical mobile stores days yet request replacement inspection phone buyers site understand fact replacement occur almost 10th day purchase still keeps uneasepros1 display screen quality good adjustment options warm light cold light2 performance streaming videos playing heavy games smooth first 4 days samsung known fast deterioration performance keep eyes ears open3 sound speaker quality okay upto mark noisy place fail hear crispness boom,"Samsung Galaxy M31 Prime Edition (Ocean Blue, 6GB RAM, 128GB Storage) - Get Complementary 3 month Prime Membership",0.021739130434782608
44,Anshul,1.0 out of 5 stars,Inferior quality and built,using 3 days 6000 mah battery name work 1125 days moderate usage64mp camera doesnt support zoom camera doesnt support 60fps video recordingbuild quality good plastic back lots figure prints minutes handling look new secondsface unlock slowheat issue charging heavy usagefull charge takes 3 hrswould recommend buy looking good camera phonego brands like oppo redmi giving much better quality,"Samsung Galaxy M31 Prime Edition (Ocean Blue, 6GB RAM, 128GB Storage) - Get Complementary 3 month Prime Membership",0.2623376623376623
45,Abhinav,1.0 out of 5 stars,Serious Issue,phone wrapped dust although seal packed still many dust screen back side shows security concerns amazon samsung seller must draw attention dust reached seal packed box im lacking trust amazonsamsung seller either phone used components might replaced brand new phonethere exists dusts built factory shows playing customer productphone nice large battery backup 2 days 64 display big camera perfect 6gb ram enough daily usage things good heating issuehowever concern dust came brand newso could give 5 starbut 1 enoughbeware amazonsamsung seller,"Samsung Galaxy M31 Prime Edition (Ocean Blue, 6GB RAM, 128GB Storage) - Get Complementary 3 month Prime Membership",0.3150649350649351
46,abin abraham,1.0 out of 5 stars,Not good at alll,software working sounds media cant attend calls every 5 mints phone gone switched even though retraining option,"Samsung Galaxy M31 Prime Edition (Ocean Blue, 6GB RAM, 128GB Storage) - Get Complementary 3 month Prime Membership",0.0
47,Akshaykumar Patil,2.0 out of 5 stars,Samsung it's not fair .,phone camera good samsung says 64 mega pixel photos like 8 megapixels photo detailing good also processor upton mark time slow hang multi function use using keyboard keyboard hide automatically 1 second mobile variant 6 gb 128 gb dont waste time money,"Samsung Galaxy M31 Prime Edition (Ocean Blue, 6GB RAM, 128GB Storage) - Get Complementary 3 month Prime Membership",0.18
48,Veerababu Puli,1.0 out of 5 stars,Worst phone,camera front worst mark waste money,"Samsung Galaxy M31 Prime Edition (Ocean Blue, 6GB RAM, 128GB Storage) - Get Complementary 3 month Prime Membership",-0.6
49,TUSHAR GOMASE,3.0 out of 5 stars,Bad Product by Samsung,samsung performance seems launched without proper test n trials already m30 decided buy m31 6gb got shocked see poor performance n battery life 64mp images cant sent easily someone whatsapp camera give errors n battery life worst m30 5000mh mobile heats charging,"Samsung Galaxy M31 Prime Edition (Ocean Blue, 6GB RAM, 128GB Storage) - Get Complementary 3 month Prime Membership",-0.33333333333333337
50,Alok Mishra,5.0 out of 5 stars,Average Phone. Critical review for Samsung so that they develop better features,first glance looks bit bulky camera display etc satisfactory overall good non chinese phonehowever improvement tried give critical feedback company phone easy writing sothat samsung india take critical review improvementbatterybattery 7k mha draining fast overall backup time slightly better average phoneuser interfaceuser interface needs tremendous improvement cant take screenshot easily need learn fine motor coordination fingers powervolume button microsecond precision three days discovered taking screenshot swapping screen easy method taking screenshot easy find setting section automatic redial isnt available also setting section searching basic operation like redial call waiting etc either missing difficult access ui intelligent intuitive call recording take permission user starts recording calldolby sounddolby sound effect excellent available external speaker inbuilt speaker dont dolby effect hv buy headphone external speaker experiencing dolby sound effect dolby software impressive work cheapest headphone samsungs inbuilt speaker doesntexternal outlookread somewhere phone 3d prism like glastic body glastic seems discovery new material glassplastic looks transparent shining reality cheap looking smooth slippery plastic back body also prone scratches neither water resistant sometimes generates heat price segment samsung easily provide metallic back better appearance transfer heatoverall good non chini phone good camera display bit bulky satisfactory speed scope tremendous improvement ui setting bit overpriced,"Samsung Galaxy M51 (Celestial Black, 8GB RAM, 128GB Storage)",0.29700956937799045
51,Sanjeev Kumar,1.0 out of 5 stars,"Not recommend, if you want waste your  money  then purchase",cons_overpricedbattery drain fast normal uses give 24 hours backupsound quality sobuild quality goodpros_good processorgood camerauser interface goodfinger print sensor working fast times missed outafter six days uses impressed camera performance display fingerprint working processordisappointed battery performance brother realme 2 giving easily 2days battery backup 4250mah phone horrible battery backup 24 hours 7000 doubt 7000 man battery like 2000 2500mah heating issue also faced charging,"Samsung Galaxy M51 (Celestial Black, 8GB RAM, 128GB Storage)",0.1638888888888889
52,Arghyajyoti Pramanik,5.0 out of 5 stars,Best Smart Phone under 25000/-,awesome camera awesome battery awesome display super clear zoomsuper macro sensorsuper ultrawide angleatlast thanks samsung 730g,"Samsung Galaxy M51 (Celestial Black, 8GB RAM, 128GB Storage)",0.6055555555555556
53,Vaibhav Patke,1.0 out of 5 stars,Pls don't buy.. cheap quality feeling waste of 25k money,genuine feedback samsung buyersnot upto markbattery good mobile heavy handy one hand operation use continuously feel pain hand designed dated poor quality material camera okayi happy overall performance phone price bandmobile perfect 1516k price bandlookwise gooddisplay qaulity good bestsound quality goodcamera much good expectingbig screen perfect movie watcher 30 minutes feel pain handsi bought electric blue colour look like samsung old samrt phone request amazon possible return mobile help returni happy overall performance phone,"Samsung Galaxy M51 (Celestial Black, 8GB RAM, 128GB Storage)",0.3875
54,Nitesh Bajpai,5.0 out of 5 stars,One of the best phones at affordable price...,ok comes first review phone ordered first day sale received 3rd day indeed big bulky phn easy handle highlights1 seamless fingerprint scanner hv heard tht recent samsung phns ths issue however dnt see ths phn gud past phns asus 6z vivo v15pro side fingerprint scanner power button really makes stylish easy handle well2 camera quality really gud wth many features luks tempting im yet explore even dim light scores quite well latest features like slow mo 10x zoom focus lens panorma view added features3 battery ofcourse highlight buying ths phn received phn 43 even rigorous 3 hr session data transfer apps installation still holds 33 believe gonna last 2 days easily wth heavy net usage mild games gud 2 hrs talk time4 luks wise seem premium despite plastic back5 wonderful touch decent processimg speed tried playing 78 apps time never hanged lagged despite 50 memory yet try heavy games though6 front cam spoil fun watching full screen videos like small black dot bt lived wth7 headphones box8 c c charging cable capable reverse charging toooverall wld rate 45 one best non chinese phn available market r luking huge battery wth decent cam light gaming purposewld update battery cam days usage,"Samsung Galaxy M51 (Celestial Black, 8GB RAM, 128GB Storage)",0.23289473684210527
55,ishan gautam,1.0 out of 5 stars,Don't buy this product. Even the most basic things are faulty,theres something wrong new samsung m51 mobile many users also facing issue unable connect wifi samsung m51meanest monster ever hahahahathis meanest monster performing poorly within 5 min unboxing eight yr old lenovo still works like charm wifiissue trying connecting wifi giving correct password says incorrect passwordi done every troubleshooting step suggested samsung tech support1 forget connection reconnect again2 update phone sw latest version3 reset settings4 reset network settings5 factory data reseti applied every step suggested techsupport result still samethe irritating thing company like samsung messup basic feature surprise even tech support run troubleshooting solutionsinstead replacing new phone tech support told get hardware fixed samsung service centre dont get take brand new phone service center get opened instead replacement phone even used hourlast year ordered mi phone flipkart battery getting drained fast within next day phone replaced without questions askeddissappointed amazon way handling issuedont spend hardearned money phone unfortunately phone turnsout faulty never ending process take care issue,"Samsung Galaxy M51 (Celestial Black, 8GB RAM, 128GB Storage)",-0.03693181818181819
56,Rajamanikandan,5.0 out of 5 stars,MONSTER FOR ALL CHINESE MOBILES,perfect mobile you1 properly read spec buying mobile2 dont expect iphone features mobile3 addictive gamer4 dont expect mobile speaker5 concern data handled chinese mobiles6 need better sar value7 first preference battery decent level camera quality8 need trending features covered non chinese mobilethen go also try update latest software setting mobile otherwise heating issue,"Samsung Galaxy M51 (Celestial Black, 8GB RAM, 128GB Storage)",0.26851851851851855
57,Pratik Prasad Gupta,2.0 out of 5 stars,Average Phone at Over Price with some bugs,giving review spending 20 days phone retail user 6 year redmi realme user buy samsung samsungsnapdragon much dispointed pros cons help user like decide whether buy notcons 1 haptic feedback2 low sound quality speaker rs 25k3 apps lock features inbuilt4 case cover box5 plain plastic back design 25k attract much scratches6 samsung trusted knox security fully enable phone ie secure folder option7 sealed package open phone display contain much dust expected packaging like brand like samsung8 gorila glass 3 protection 25k ie dated glass protection using 2 days full care got one scratch mark display9 nfc given samsung pay phone10 audio output boat rockers bluetooth headset phone much lound compare previous phone redmi note 7 pro11 without using phone take 2 hour charge use frequently take 2303 hour charged full 010012 full battery drained 12 hour non stop used including youtube whatsapp facebook messaging etc except game13 carrier aggregation using jio sim samsung m51 realme x2 pro contain different net speed samsung giving 5mbps realme x2 pro giving 910mbps14 calling issue talking ear piece call person hear voice clearly put call loudspeaker receiver call cant hear voice hear sound low turning back earpiece person able hear again15 camera zoom quality good focus sky whole pic turn blue ie saturation level much high phone image attached16 watching movie video phone playing video youtube brightness fluctuate fast much automatically ie adaptive brightness issuepros 1 super amoled plus display2 camera quality good3 7000 mah battery4 till ram management goodto much hype created every phone due many user like purchased phone phone 25k really value money going resale phone many phone 25k best facilities compare samsung m51conclusion phone overpriced performance average,"Samsung Galaxy M51 (Celestial Black, 8GB RAM, 128GB Storage)",0.19425353925353928
58,SRIDHAR LOGANATHAN ,5.0 out of 5 stars,Superior Phone from samsung at budget rate.,using 2 days must say snapdragon 730g works wonderful camerathis time series honest job giving us intelli camera 64 mega pixcel feature selfie cameradisplay fingerprintwith samsung superamoled display truly trust amazing view angle m51 feature widevine l certification enjoy global dolby theatre experience found reliable 1920p 4k level movie watching without distraction due infinite display gives full screen ratio fingerprint side much faster expected doesnt takes second also open even faceunlock fastersuperior matches series flagship premium classy look strong built budget amount 67 inches display good handle well managed one hand use also,"Samsung Galaxy M51 (Celestial Black, 8GB RAM, 128GB Storage)",0.2970238095238095
59,dnyanesh jalamkar,2.0 out of 5 stars,Issues with camera. Unhappy with samsung.,issue camera night mode pro modeit seems like dust present camera sensor visible dark photos photo clicked lens covered completely shows hundreds white spots image happens pro mode regular image noise,"Samsung Galaxy M51 (Celestial Black, 8GB RAM, 128GB Storage)",-0.009999999999999998
60,Suman Biswas,1.0 out of 5 stars,Keep away from Amazon when it's Apple.,may first negative review product amazon much elated receive iphone 11 fast next day dispatch ie 280919 thing got started heating every contacted applecare consoled quite normal continued tried return product speaking amazon customer support vain body called back convey apple decide one take back amazon took sacred duty selling item cant exchange control product developed new issues like proximity sensor malfunction last importantly loosing mobile network every minuteeven two software updates handed apple asp return window closed 101019 use diagnosed issues sent apple repair facility bengaluru im wout first iphone using itsuffering little 2 weeks credit goes amazon bravo keep amazon,"Apple iPhone 11 (128GB) - Black (Includes EarPods, Power Adapter)",0.07325757575757574
61,Neha,1.0 out of 5 stars,Do not buy iphone or expensive product from Amazom,please buy expensive product like iphone amazon bad exp charger cord missing sound quality issues amazon initial told charger doesnt come box challenged asked reimburse cord amount requested replacement days called informed dont take responsibility missing items 10 day replacement policy dont follow read email conversation attached mentioned every thing call recordings well last denied phone replacement even provide missing cord damage quality issues said amazon responsible,"Apple iPhone 11 (128GB) - Black (Includes EarPods, Power Adapter)",-0.1333333333333333
62,shanu Kumar,5.0 out of 5 stars,Solid premium phone from Apple,awesome phone nice upgrade iphone 6s iphone 11 love beautiful phone,"Apple iPhone 11 (128GB) - Black (Includes EarPods, Power Adapter)",0.7375
63,Sunny Kumar,5.0 out of 5 stars,First Time iPhone User Review :-),iphone design good camera quality awesome also take pictures wide angles image quality awesomephone got delivered 9am 28th september preorder 27th september 3am morning got phone delivery date nice secured packagingthe overall look phone premium face unlocking fast grabbed phone hdfc 6k instant discount offer 64k 128 gb variantcons1 phone great use box accessories like earpods lighting connector might feel little pain ears2 phone comes 5w charger charge phone slowly recommend prefer using 18w chargerwell ive never tried iphone im using first time yes im already using apple products like macbook air probut product great im lovin,"Apple iPhone 11 (128GB) - Black (Includes EarPods, Power Adapter)",0.31354166666666666
64,Amazon Customer,1.0 out of 5 stars,Worst Experience Ever.!,phone producing much heat even didnt put sim never used half hour producing much heat totally disappointed amazon saying go icare services calling customer care several times amazon cant anything worst experience amazon one would like repair new phone better go shop buy apple products,"Apple iPhone 11 (128GB) - Black (Includes EarPods, Power Adapter)",-0.1100378787878788
65,Krusshna,1.0 out of 5 stars,Don’t buy it from this seller,bought mobile appario retail ltd mobile heating within seconds also camera modes arent working properly particularly portrait mode stage light mono options arent working properly raised apple customer care confirmed software issue amazon customer care told need job card report apple service center nearest service center located 210km place imagine amount strain much going cost buy anything seller google u find numerous complaints seller ever sell u find defective products thread sellers dubious deals quora please safe dont regret,"Apple iPhone 11 (128GB) - Black (Includes EarPods, Power Adapter)",0.16296296296296298
66,Satyapal singh,1.0 out of 5 stars,iPhone 11,defective productgot heat within 5 minutes starting need return fastvery bad experience,"Apple iPhone 11 (128GB) - Black (Includes EarPods, Power Adapter)",-0.3499999999999999
67,Gurmeet singh,1.0 out of 5 stars,Defective Iphone 11,product got defective face id working back camera also working lot hassle get exchanged apple service centre also much help product amazon please buy phones apple store get right product,"Apple iPhone 11 (128GB) - Black (Includes EarPods, Power Adapter)",0.1619047619047619
68,Ghar Sayan,5.0 out of 5 stars,Best iPhone ever | Super Night Mode | Super Camera | Yellow,opinion dont think much phone get attaching nightmode pictures check differencepros1 best camera2 best security3 long day battery life4 touch id improved5 iphone 6 best nightmode support7 best processors a13 bionic chipcons1 display could oled price doesnt matter retina lcd really awesome2 slightly bulky weighty u r shifting iphone 7 83 thick bezelsguys samsung well iphone fan price range would suggest order iphone 11 really great dealand u r long time iphone user really great yougot guys,"Apple iPhone 11 (128GB) - Black (Includes EarPods, Power Adapter)",0.4527777777777778
69,Masood Ansari,1.0 out of 5 stars,SELLER SENT ACTIVATED AND REPACKED IPHONE,purchased iphone 11 seller 20th july 2020 got delivered 21st july checked phone settings showed warranty expiring 29th march 2021 phone already activated march 2020 seller repacked sold iphone labelled brand new phone,"Apple iPhone 11 (128GB) - Black (Includes EarPods, Power Adapter)",0.04545454545454545
70,Hitesh kumawat,5.0 out of 5 stars,Beast Phone of The Year! 🤔,triple cameras iphone 11 pro max give apple best camera phone thanks great night mode improved smart hdra huge improvement battery life 20 hours video playback 12 hours video streaming apples slowmotion selfies fun 120 fpsapple given pro moniker iphones first time everything improved everything feels betterit comes new lightning usb cable 5w usb power adapterwith display 65inch super retina xdr display hdrtrue tone splash water dust resistant waterresistant depth 4 meters 30 minutes ip68 triple 12mp cameras ultra wide wide telephoto portrait mode night mode auto adjustments nextgeneration smart hdr 4k video 60 fps extended dynamic range,Apple iPhone 11 Pro Max (64GB) - Midnight Green,0.2806360306360306
71,ravisde,3.0 out of 5 stars,Nice buttery smooth in iOS 13 only,pre ordered item sept 21 received ok 2 oct ios 13 buttery smooth nice update ios1312 available updating stuck apple logo could create return amazon asked contact apple wonder,Apple iPhone 11 Pro Max (64GB) - Midnight Green,0.475
72,R3,5.0 out of 5 stars,Fab 💋,decent packaging shipping upgraded iphone x reckon definitely worth size matters pun intended instantly feel difference bw 57 inch screen 65 inch iphone x earlier model definitely consider upgrading iphone xs max better waiting next year model touted undergo radical changes 5g usbc touch id comeback notch less design perhaps 5g model doesnt make difference least india even 5g spectrum auctioned yet wifi performance better iphone x model supports 11ax protocol way stuck choice bw gold midnight green go gold thank later,Apple iPhone 11 Pro Max (64GB) - Midnight Green,0.06666666666666667
73,Amazon Customer,1.0 out of 5 stars,LOST MY KIDNEYS,lost kidneys,Apple iPhone 11 Pro Max (64GB) - Midnight Green,0.0
74,G G.,1.0 out of 5 stars,11 pro Max,11 pro max 256 gb phone hanged last 12 hours continues,Apple iPhone 11 Pro Max (64GB) - Midnight Green,0.0
75,Nitish ,1.0 out of 5 stars,Hangs multiple times,rate one start product experience using phone one week subpar multiple times one week phone hanged many time even home screen hanged installed five additional apps quora amazon facebook whatsapp google maps please refrain purchasing phone waste money,Apple iPhone 11 Pro Max (64GB) - Midnight Green,0.09999999999999999
